{
  "version": 1,
  "updatedAt": "2026-01-28T00:00:00Z",
  "enabled": [
    "agency",
    "strategic_depth",
    "seat_imbalance",
    "variety",
    "pacing_tension",
    "turn_taking_rate",
    "interaction_rate",
    "structural_complexity"
  ],
  "normalization": {
    "nonFinite": "zero"
  },
  "featureOrder": [
    "agency",
    "strategic_depth",
    "seat_imbalance",
    "variety",
    "pacing_tension",
    "turn_taking_rate",
    "interaction_rate",
    "structural_complexity"
  ]
}
